{
    "base": "basereport",
    "name": "promotions sample report",
    "commands": {
        "getTypeCodes": {
            "commandText": "EXEC HEDE {{{supplier}}} asdad { asdad }"
        }
    },
    "filters": {
        "supplier": {
            "displayName": "Dukkan",
            "dataType": "string",
            "children": {
                "status": {
                    "displayName": "Durum",
                    "dataType": "int32"
                }
            }
        }
    }
}