{
    "$schema": "https://raw.githubusercontent.com/adriva/coreframework/master/Reporting/src/Adriva.Extensions.Reporting.Abstractions/report-schema.json",
    "name": "Ileri Vadeli Odemeler",
    "base": "root",
    "contextProvider": "demo.Controllers.ReportContextProvider, demo",
    "commands": {
        "OutputQuery": {
            "commandText": "/Finance/GetForwardTermPayments?salesOrganizationCode=@salesOrganizationCode&distributionChannelCode=@distributionChannelCode&accountCode=@accountCode&pageIndex=@pageIndex&pageSize=@pageSize&isPagedResult=@isPagedResult"
        }
    },
    "filters": {
        "salesOrganizationCode": {
            "properties": "Context",
            "defaultValue": "GetCurrentDate"
        }
    }
}